{
  "$schema": "https://themachineweb.org/pagefront/commerce/schemas/product/v0.4.1.json",
  "format_version": "0.4.1",
  "schema_org_version": "30.0",
  "canonical_url": "https://afs-foiling.com/product/whitebird-mid-length",
  "artifact_url": "https://afs-foiling.com/pagefront/products/whitebird-mid-length.json",
  "generated_at": "2026-05-12T10:00:00Z",
  "expires_at": "2026-05-12T11:00:00Z",
  "data": {
    "@context": [
      "https://schema.org",
      {
        "pagefront": "https://themachineweb.org/pagefront/vocabulary/"
      }
    ],
    "@type": "Product",
    "@id": "https://afs-foiling.com/product/whitebird-mid-length#product",
    "url": "https://afs-foiling.com/product/whitebird-mid-length",
    "name": "Whitebird Mid Length",
    "productID": "whitebird-mid-length",
    "inLanguage": "en",
    "brand": {
      "@type": "Brand",
      "name": "AFS",
      "url": "https://afs-foiling.com"
    },
    "manufacturer": {
      "@type": "Organization",
      "name": "Foil And Co.",
      "address": {
        "@type": "PostalAddress",
        "streetAddress": "Espace Joseph Rolland",
        "addressLocality": "Pencran",
        "postalCode": "29800",
        "addressRegion": "Finistère",
        "addressCountry": "FR"
      }
    },
    "description": "All-road board only. Lightweight and high-performance, the Whitebird Mid Length is an ally for light wind, downwind, sup foil and sup foil downwind sessions. Its compact, accessible shape makes it an easy downwind freeride board with excellent stability. The width optimises ride-offset for good manoeuvrability and turning. Soft rails and a soft hull deliver tolerance on touchdowns with a gentle rebound. The hollow deck lowers the rider's centre of gravity for direct, precise foil feel; advanced foil-box positioning provides ultra-light-wind take-off capability with the inertia profile of a small board and the take-off behaviour of a long one.",
    "category": "Sports & Outdoors > Watersports > Foiling > Foil Boards",
    "image": [
      {
        "@type": "ImageObject",
        "url": "https://afs-foiling.com/fr/wp-content/uploads/2025/06/image-33-1.png",
        "caption": "Whitebird Mid Length, packshot",
        "additionalProperty": [
          {
            "@type": "PropertyValue",
            "name": "role",
            "value": "packshot"
          },
          {
            "@type": "PropertyValue",
            "name": "role",
            "value": "hero"
          }
        ]
      }
    ],
    "additionalProperty": [
      {
        "@type": "PropertyValue",
        "name": "discipline",
        "value": "wing_foil"
      },
      {
        "@type": "PropertyValue",
        "name": "discipline",
        "value": "downwind"
      },
      {
        "@type": "PropertyValue",
        "name": "discipline",
        "value": "sup_foil"
      },
      {
        "@type": "PropertyValue",
        "name": "discipline",
        "value": "sup_foil_downwind"
      },
      {
        "@type": "PropertyValue",
        "name": "board_type",
        "value": "mid_length"
      },
      {
        "@type": "PropertyValue",
        "name": "foil_box",
        "value": "US double rail"
      },
      {
        "@type": "PropertyValue",
        "name": "deck_shape",
        "value": "hollow deck"
      },
      {
        "@type": "PropertyValue",
        "name": "tail_shape",
        "value": "T-tail"
      },
      {
        "@type": "PropertyValue",
        "name": "nose_shape",
        "value": "bulbous"
      }
    ],
    "pagefront:construction": {
      "@type": "pagefront:Construction",
      "constructionNotes": "PVC Sandwich with Glass and Carbon. Hollow deck for lowered centre of gravity; longitudinal and lateral concave for direct foil feel; T-tail with reduced wetted surface; bulbous nose to soften touchdowns; advanced (forward-positioned) foil-box housings for ultra-light-wind take-off."
    },
    "pagefront:materialComposition": [
      {
        "@type": "pagefront:Material",
        "material": "PVC sandwich core"
      },
      {
        "@type": "pagefront:Material",
        "material": "glass fibre"
      },
      {
        "@type": "pagefront:Material",
        "material": "carbon fibre"
      }
    ],
    "pagefront:manufacturingChain": [
      {
        "@type": "pagefront:ManufacturingStage",
        "stage": "design_and_rd",
        "country": "FR",
        "facility": "Foil And Co., Pencran (Brittany)"
      },
      {
        "@type": "pagefront:ManufacturingStage",
        "stage": "board_manufacturing",
        "country": "TN",
        "facility": "Terminatech"
      }
    ],
    "offers": [
      {
        "@type": "Offer",
        "@id": "https://afs-foiling.com/product/whitebird-mid-length#offer",
        "priceSpecification": {
          "@type": "PriceSpecification",
          "priceCurrency": "EUR",
          "description": "Configurator-priced — total depends on selected size. Price not retrieved (rendered client-side)."
        },
        "priceCurrency": "EUR",
        "availability": "https://schema.org/InStock",
        "itemCondition": "https://schema.org/NewCondition",
        "seller": {
          "@type": "Organization",
          "name": "Foil And Co.",
          "url": "https://afs-foiling.com"
        },
        "shippingDetails": [
          {
            "@type": "OfferShippingDetails",
            "name": "Worldwide delivery"
          }
        ],
        "hasMerchantReturnPolicy": {
          "@type": "MerchantReturnPolicy",
          "returnPolicyCategory": "https://schema.org/MerchantReturnFiniteReturnWindow",
          "merchantReturnDays": 15,
          "returnFees": "https://schema.org/FreeReturn"
        },
        "warranty": {
          "@type": "WarrantyPromise",
          "durationOfWarranty": {
            "@type": "QuantitativeValue",
            "value": 2,
            "unitCode": "ANN"
          }
        },
        "acceptedPaymentMethod": [
          "Credit Card",
          "Installments (3x or 4x)"
        ]
      }
    ],
    "pagefront:configurator": {
      "@type": "pagefront:Configurator",
      "basePriceCurrency": "EUR",
      "priceFormula": "size selection determines total price; modifiers not retrieved",
      "dimensions": [
        {
          "name": "size",
          "options": [
            {
              "value": "5'8",
              "description": "5'8 / 173 cm, 50.8 cm / 20\" wide, 85 L, 6.0 kg, front and rear strap inserts. Wing foil intermediate/expert all weights; designed for high-performance small-surface foils in light wind."
            },
            {
              "value": "6'6",
              "description": "6'6 / 198 cm, 53.3 cm / 21\" wide, 100 L, 6.0 kg, front strap inserts only. Wing foil beginner under 80 kg."
            },
            {
              "value": "6'8",
              "description": "6'8 / 203 cm, 58.4 cm / 23\" wide, 115 L, 6.5 kg, front strap inserts only. Wing foil beginner over 80 kg."
            }
          ]
        }
      ]
    },
    "isVariantOf": {
      "@type": "ProductGroup",
      "@id": "https://afs-foiling.com/product/whitebird-mid-length#group",
      "productGroupID": "whitebird-mid-length",
      "name": "Whitebird Mid Length",
      "variesBy": [
        "size"
      ],
      "hasVariant": [
        {
          "@type": "Product",
          "name": "Whitebird Mid Length 5'8",
          "additionalProperty": [
            {
              "@type": "PropertyValue",
              "name": "size",
              "value": "5'8"
            },
            {
              "@type": "PropertyValue",
              "name": "length_cm",
              "value": "173"
            },
            {
              "@type": "PropertyValue",
              "name": "width_cm",
              "value": "50.8"
            },
            {
              "@type": "PropertyValue",
              "name": "width_inches",
              "value": "20"
            },
            {
              "@type": "PropertyValue",
              "name": "volume_litres",
              "value": "85"
            },
            {
              "@type": "PropertyValue",
              "name": "weight_kg",
              "value": "6.0"
            },
            {
              "@type": "PropertyValue",
              "name": "foil_box",
              "value": "US double rail"
            },
            {
              "@type": "PropertyValue",
              "name": "strap_inserts",
              "value": "front_and_rear"
            }
          ]
        },
        {
          "@type": "Product",
          "name": "Whitebird Mid Length 6'6",
          "additionalProperty": [
            {
              "@type": "PropertyValue",
              "name": "size",
              "value": "6'6"
            },
            {
              "@type": "PropertyValue",
              "name": "length_cm",
              "value": "198"
            },
            {
              "@type": "PropertyValue",
              "name": "width_cm",
              "value": "53.3"
            },
            {
              "@type": "PropertyValue",
              "name": "width_inches",
              "value": "21"
            },
            {
              "@type": "PropertyValue",
              "name": "volume_litres",
              "value": "100"
            },
            {
              "@type": "PropertyValue",
              "name": "weight_kg",
              "value": "6.0"
            },
            {
              "@type": "PropertyValue",
              "name": "foil_box",
              "value": "US double rail"
            },
            {
              "@type": "PropertyValue",
              "name": "strap_inserts",
              "value": "front_only"
            }
          ]
        },
        {
          "@type": "Product",
          "name": "Whitebird Mid Length 6'8",
          "additionalProperty": [
            {
              "@type": "PropertyValue",
              "name": "size",